{
  "schemaVersion": "1.0",
  "artifactType": "trusted-environment-verification",
  "payload": {
    "collectorVersion": "1.0",
    "collectionMode": "Mock",
    "decisionSha256": "a286513b3d61f281809606833c0411cd2f00a23dc4e5185f054acbd4c26b2332",
    "catalogSnapshotId": "sha256:bbbbbbbbbbbbbbbbbbbbbbbbbbbbbbbbbbbbbbbbbbbbbbbbbbbbbbbbbbbbbbbb",
    "dependencyManifestSha256": "f48b1526618a8ad2179a270793fda359a6088af5f77af6ed06bcef7d455a3605",
    "inputFingerprints": {
      "analysisManifest": "7d3a4aef9429eba5560c2a7c343118fea06c1bc7e43edb95b06b2b2a111ab377",
      "componentDelta": "8bedd7ff8c0392f2483c9a7c31386618837e8ce825bcf4c07a662fabd79a11c4",
      "coverage": "b011fc7af5f47142d33d2cca6cf381036b112451f1583e6bbcff8f7c9d4ed296",
      "decision": "a286513b3d61f281809606833c0411cd2f00a23dc4e5185f054acbd4c26b2332",
      "dependencies": "f48b1526618a8ad2179a270793fda359a6088af5f77af6ed06bcef7d455a3605",
      "environment": "68a877f3202bd3c11d96466654954c58f67e2a8635ebe6f5e8a3908dceeaf7d7",
      "packageManifest": "b30e9a772397474d5d1b9cc8b0ce2c553d28d04e126177331eaf251dd17d1e09",
      "schemaPlan": "0a232eb78604190f578e7fea6ef46bc643b0183a2bd99b32c0878321182bca06",
      "spec": "00b9136626ee9240fa5fcf3f868ed4003987244c6e542ecd9593331c371258da",
      "traceability": "a0846e8a37b6cab17d465fbc604d0b6e734539b1417e042e911b8fb3f4a7271f",
      "package:synthetic-records": "65e1329dcfa1771c55b104f6e64af1629c4aa4a1af55a2b645850bf732aac321"
    },
    "selectedPackages": [
      {
        "moduleId": "synthetic-records",
        "packageId": "synthetic-records-v1",
        "version": "1.0.0.0",
        "sha256": "cccccccccccccccccccccccccccccccccccccccccccccccccccccccccccccccc"
      }
    ],
    "authenticatedIdentity": {
      "organizationId": "99999999-9999-4999-8999-999999999999",
      "principalId": "33333333-3333-4333-8333-333333333333",
      "aadObjectId": "aaaaaaaa-aaaa-4aaa-8aaa-aaaaaaaaaaaa"
    },
    "complete": true,
    "checks": [
      {
        "id": "authenticated-connection",
        "target": "https://synthetic.example.test",
        "state": "verified",
        "satisfied": true,
        "requiredForReadiness": true,
        "blockingStatus": "BLOCKED_EVIDENCE",
        "message": "WhoAmI authentication must succeed without using a stored environment target."
      },
      {
        "id": "authenticated-context-stable",
        "target": "33333333-3333-4333-8333-333333333333",
        "state": "verified",
        "satisfied": true,
        "requiredForReadiness": true,
        "blockingStatus": "BLOCKED_SECURITY",
        "message": "The authenticated principal and organization must remain stable through collection and token refresh."
      },
      {
        "id": "component-cardinality",
        "target": "FAST006-REUSE-345219E8B4EB",
        "state": "verified",
        "satisfied": true,
        "requiredForReadiness": true,
        "blockingStatus": "BLOCKED_COMPATIBILITY",
        "message": "Metadata must return zero or one exact logical-name match, never an ambiguous or substituted component."
      },
      {
        "id": "component-owner",
        "target": "FAST006-REUSE-345219E8B4EB",
        "state": "verified",
        "satisfied": false,
        "requiredForReadiness": true,
        "blockingStatus": "BLOCKED_COMPATIBILITY",
        "message": "Ownership requires exact solution-component membership and publisher metadata; prefix alone is not ownership proof."
      },
      {
        "id": "environment-identity",
        "target": "https://synthetic.example.test",
        "state": "verified",
        "satisfied": true,
        "requiredForReadiness": true,
        "blockingStatus": "BLOCKED_DECISION_CHANGE",
        "message": "Server-reported environment, tenant and organization must match the explicit target and WhoAmI context."
      },
      {
        "id": "extension-publisher",
        "target": "extension_solution",
        "state": "verified",
        "satisfied": true,
        "requiredForReadiness": true,
        "blockingStatus": "BLOCKED_COMPATIBILITY",
        "message": "The selected extension solution must be unmanaged and have the exact planned publisher identity/prefix."
      },
      {
        "id": "installed-solution",
        "target": "synthetic_records",
        "state": "verified",
        "satisfied": false,
        "requiredForReadiness": true,
        "blockingStatus": "BLOCKED_PREREQUISITES",
        "message": "The required solution must be installed exactly once."
      },
      {
        "id": "managed-property",
        "target": "FAST006-REUSE-345219E8B4EB",
        "state": "verified",
        "satisfied": true,
        "requiredForReadiness": true,
        "blockingStatus": "BLOCKED_EVIDENCE",
        "message": "Actual managed state must be returned by the metadata service."
      },
      {
        "id": "package-content-hash",
        "target": "synthetic-records-v1",
        "state": "inferred",
        "satisfied": false,
        "requiredForReadiness": false,
        "blockingStatus": "BLOCKED_EVIDENCE",
        "message": "The SHA-256 identifies the approved local package; Dataverse does not attest the original installed ZIP bytes."
      }
    ],
    "evidence": {
      "schemaVersion": "1.0",
      "decisionId": "sha256:a1ce35f9a2044e9af46813d2aa190b6cb1102f4696d9c5004bfa83a33232bf87",
      "planId": "sha256:b326c49dda9c42eef8debaff28e53e4073c503eaf91734bb854374f3f28d07f1",
      "planSha256": "00b9c2aa618f790b9eeaf79ba9aa289e1aba502471abfee765a4598794dfda7a",
      "environment": {
        "environmentId": "11111111-1111-4111-8111-111111111111",
        "tenantId": "22222222-2222-4222-8222-222222222222",
        "url": "https://synthetic.example.test"
      },
      "observedAtUtc": "2026-10-19T12:00:00.0000000+00:00",
      "expiresAtUtc": "2026-10-19T12:15:00.0000000+00:00",
      "inputArtifacts": [
        {
          "key": "analysisManifest",
          "path": "specs/missing-accelerator/accelerator/accelerator-analysis-manifest.json"
        },
        {
          "key": "componentDelta",
          "path": "specs/missing-accelerator/accelerator/component-delta-analysis.json"
        },
        {
          "key": "coverage",
          "path": "specs/missing-accelerator/accelerator/requirements-coverage-matrix.json"
        },
        {
          "key": "decision",
          "path": "specs/missing-accelerator/accelerator/accelerator-decision.json"
        },
        {
          "key": "dependencies",
          "path": "specs/missing-accelerator/accelerator/dependency-manifest.json"
        },
        {
          "key": "environment",
          "path": "specs/missing-accelerator/accelerator/environment-readiness-reference.json"
        },
        {
          "key": "packageManifest",
          "path": "specs/missing-accelerator/accelerator/package-input-manifest.json"
        },
        {
          "key": "schemaPlan",
          "path": "specs/missing-accelerator/accelerator/schema-reuse-extension-plan.json"
        },
        {
          "key": "spec",
          "path": "specs/missing-accelerator/spec.md"
        },
        {
          "key": "traceability",
          "path": "specs/missing-accelerator/accelerator/acceptance-traceability.json"
        }
      ],
      "packages": [
        {
          "moduleId": "synthetic-records",
          "packageId": "synthetic-records-v1",
          "sha256": "cccccccccccccccccccccccccccccccccccccccccccccccccccccccccccccccc",
          "solutionUniqueName": "synthetic_records",
          "version": "1.0.0.0",
          "installed": false,
          "dependencies": []
        }
      ],
      "components": [
        {
          "taskId": "FAST006-REUSE-345219E8B4EB",
          "componentKind": "table",
          "componentIdentity": "tst_record",
          "exists": true,
          "ownership": "unresolved",
          "managed": true,
          "customizable": true,
          "allowedActions": [
            "REUSE"
          ]
        }
      ],
      "security": {
        "principalId": "33333333-3333-4333-8333-333333333333",
        "grantedPermissions": [
          "read-metadata"
        ]
      }
    }
  },
  "signature": {
    "algorithm": "RS256",
    "certificateSha256": "655f507d1baa753ff9e0521f52c994d3ca6faa3d9f30469ac5b6e055e10b0680",
    "value": "g0Uu+tdkilgw6upSRv1mf4Fk69nDbuV38ocdha/q51nS6p4qi3wSb9WcM5gEX5Sx39ebObhULByHef1awtndKGYY0lWAMWwqNxrXKxWHf8QMwmPSYjj9TKfnsUmoei6UK1LlU13fwwUA7xK8kugY+YRoZffqQKhDOwm08g9NEQTjBTS3/dwJ7Esmx9DltFd/TZSgCODecHrouoKL7cmy1AAwhR/SITCBGOA6dH9h1dMYFUWx9Y1xY10esrt18TCAZ5x5RQFKWZrM7eCzWX2ddAjiSyT//h3PZuQ9RjD7Zj56wsMrfImv7dC0mZN15D8eAC3+DnVuxdNA5OHK9zbJ5A=="
  }
}
